official_title,study_first_posted_date,verification_date,start_date,start_month_year,nct_id,phase,last_known_status,study_type,enrollment,overall_status,facilitiesCount,multisite,funding,fundingComb,intervention_comb,interventionType,interventionTypeCombined,were_results_reported,pubCount,pubCountBool,diverse,diverseGroup,yearStart,numMissing,interventionDrugNonDrug,industryNonIndustry,raceSpecific
Care Guides: Can Trained Laypersons Help Manage Chronic Disease? A Randomized Trial.,7/5/2010,4/30/2019,7/31/2010,Jul-10,NCT01156974,Phase 2,NA,Interventional,2135,Completed,1,FALSE,Other,Other,"Behavioral, Behavioral",Behavioral,Behavioral,FALSE,3,TRUE,Non-race specific,Non-race specific,2010,1,Non-Drug Intervention,Non-Industry Sponsor,Non-Race Specific
Louisiana State University Health Care Services Division Tele-Health Projects: Weight Loss in Chronic Disease Patient Population,7/1/2010,4/30/2011,1/31/2010,Jan-10,NCT01155050,Not Applicable,NA,Interventional,240,Completed,3,TRUE,Other,Other,"Device, Behavioral, Device",Behavioral,Behavioral,FALSE,NA,FALSE,Non-race specific,Non-race specific,2010,2,Non-Drug Intervention,Non-Industry Sponsor,Non-Race Specific
MIPARC - Multilevel Intervention for Physical Activity in Retirement Communities,7/1/2010,8/31/2017,1/31/2011,Jan-11,NCT01155011,Not Applicable,NA,Interventional,307,Completed,1,FALSE,NIH,Public,"Behavioral, Behavioral, Behavioral, Behavioral, Behavioral, Behavioral, Behavioral, Behavioral, Behavioral, Behavioral",Behavioral,Behavioral,TRUE,7,TRUE,Non-race specific,Non-race specific,2010,1,Non-Drug Intervention,Non-Industry Sponsor,Non-Race Specific
"An Evaluation of the Pharmacokinetic Linearity and Comparative Bioavailability of a Single Oral Dose of 0.5 mg, 1 mg and 2.5 mg UT-15C (Treprostinil Diethanolamine) SR Tablets in Healthy Volunteers in the Fed State",6/30/2010,8/31/2010,7/31/2010,Jul-10,NCT01153386,Phase 1,NA,Interventional,36,Completed,1,FALSE,Industry,Industry,Drug,Drug,Pharmaceutical,FALSE,NA,FALSE,Non-race specific,Non-race specific,2010,2,Drug Intervention,Industry Sponsor,Non-Race Specific
Health Promotion Outreach To Overcome Clinical Inertia In The Treatment Of Patients With Poorly-Controlled Hypertension,6/16/2010,8/31/2018,11/30/2009,Nov-09,NCT01145391,Not Applicable,NA,Interventional,591,Completed,1,FALSE,Industry,Industry,Other,other,other,TRUE,1,TRUE,Non-race specific,Non-race specific,2010,1,Non-Drug Intervention,Industry Sponsor,Non-Race Specific
Cardiovascular Intervention Improvement Telemedicine Study,6/11/2010,4/30/2016,11/30/2011,Nov-11,NCT01142908,Not Applicable,NA,Interventional,428,Completed,1,FALSE,U.S. Fed,Public,Behavioral,Behavioral,Behavioral,TRUE,4,TRUE,Non-race specific,Non-race specific,2010,1,Non-Drug Intervention,Non-Industry Sponsor,Non-Race Specific
Controlling Hypertension Outcomes by Improved Communication & Engagement (CHOICE),6/2/2010,6/30/2017,9/1/2009,1-Sep-09,NCT01134887,Not Applicable,NA,Interventional,26,Completed,2,TRUE,U.S. Fed,Public,"Other, Behavioral, Other, Behavioral, Other",Behavioral,Behavioral,TRUE,NA,FALSE,Non-race specific,Non-race specific,2010,2,Non-Drug Intervention,Non-Industry Sponsor,Non-Race Specific
An Evaluation of the Pharmacokinetics and Safety of a Single Dose of UT-15C SR (Treprostinil Diethanolamine) in Subjects With Renal Impairment.,5/27/2010,5/31/2012,5/31/2010,May-10,NCT01131845,Phase 1,NA,Interventional,16,Completed,1,FALSE,Industry,Industry,Drug,Drug,Pharmaceutical,FALSE,NA,FALSE,Non-race specific,Non-race specific,2010,2,Drug Intervention,Industry Sponsor,Non-Race Specific
Evaluation of Integrating Self Blood Pressure Monitoring Into Urban Primary Care Practices to Improve Ethnic/ Racial Disparities in Hypertension,5/14/2010,8/31/2012,5/31/2010,May-10,NCT01123577,Not Applicable,NA,Interventional,899,Completed,4,TRUE,Other,Other,Other,other,other,FALSE,4,TRUE,Non-race specific,Non-race specific,2010,1,Non-Drug Intervention,Non-Industry Sponsor,Non-Race Specific
"Obesity, Hypertension in African American Women, Neuro-metabolic Mechanism",5/13/2010,1/31/2017,1/31/2010,Jan-10,NCT01122407,Phase 1,NA,Interventional,34,Completed,1,FALSE,NIH,Public,"Drug, Drug",Drug,Pharmaceutical,FALSE,NA,FALSE,African American,Race-specific,2010,2,Drug Intervention,Non-Industry Sponsor,Non-Race Specific
Reducing Risk of Recurrences: Issues in Maintenance and Stability in Stroke (CDA 08-009),5/13/2010,8/31/2016,1/31/2010,Jan-10,NCT01122394,Not Applicable,NA,Interventional,140,Completed,1,FALSE,U.S. Fed,Public,"Behavioral, Behavioral",Behavioral,Behavioral,TRUE,NA,FALSE,Non-race specific,Non-race specific,2010,2,Non-Drug Intervention,Non-Industry Sponsor,Non-Race Specific
Post Kidney Transplant Nocturnal Hypertension Prevalence and Management Study,5/11/2010,5/31/2013,4/30/2010,Apr-10,NCT01120613,Not Applicable,NA,Interventional,0,Withdrawn,1,FALSE,Other,Other,Drug,Drug,Pharmaceutical,FALSE,13,TRUE,Non-race specific,Non-race specific,2010,1,Drug Intervention,Non-Industry Sponsor,Non-Race Specific
Improving Patient Understanding of Preeclampsia,5/7/2010,7/31/2011,4/30/2010,Apr-10,NCT01119183,Not Applicable,NA,Interventional,120,Completed,1,FALSE,Other,Other,"Behavioral, Behavioral, Behavioral",Behavioral,Behavioral,FALSE,NA,FALSE,Non-race specific,Non-race specific,2010,2,Non-Drug Intervention,Non-Industry Sponsor,Non-Race Specific
NA,5/3/2010,5/31/2011,4/30/2010,Apr-10,NCT01114893,Phase 2,NA,Interventional,60,Completed,1,FALSE,Industry,Industry,"Drug, Drug, Drug",Drug,Pharmaceutical,TRUE,NA,FALSE,Non-race specific,Non-race specific,2010,3,Drug Intervention,Industry Sponsor,Non-Race Specific
Melatonin and Nighttime Blood Pressure in African Americans--24 mg Study,5/3/2010,1/31/2016,6/30/2010,Jun-10,NCT01114373,Phase 2,NA,Interventional,40,Completed,1,FALSE,NIH,Public,"Drug, Drug",Drug,Pharmaceutical,TRUE,NA,FALSE,African American,Race-specific,2010,2,Drug Intervention,Non-Industry Sponsor,Non-Race Specific
Melatonin and Nighttime Blood Pressure in African Americans- 8 mg Study,5/3/2010,11/30/2015,3/31/2010,Mar-10,NCT01114360,Phase 2,NA,Interventional,37,Completed,1,FALSE,NIH,Public,"Drug, Drug",Drug,Pharmaceutical,TRUE,NA,FALSE,African American,Race-specific,2010,2,Drug Intervention,Non-Industry Sponsor,Non-Race Specific
Hypertonic Saline vs. Mannitol for Elevated Intercranial Pressure,4/27/2010,3/31/2013,4/30/2010,Apr-10,NCT01111682,Phase 3,NA,Interventional,5,Terminated,1,FALSE,U.S. Fed,Public,"Drug, Drug",Drug,Pharmaceutical,FALSE,5,TRUE,Non-race specific,Non-race specific,2010,1,Drug Intervention,Non-Industry Sponsor,Non-Race Specific
NA,4/26/2010,7/31/2014,6/30/2010,Jun-10,NCT01110499,Phase 2,NA,Interventional,163,Completed,1,FALSE,Industry,Industry,"Drug, Drug, Drug, Drug, Drug, Drug, Drug, Drug",Drug,Pharmaceutical,TRUE,NA,FALSE,Non-race specific,Non-race specific,2010,3,Drug Intervention,Industry Sponsor,Non-Race Specific
Yoga as a Complex Intervention for Vets With Stroke,4/23/2010,11/30/2015,7/31/2010,Jul-10,NCT01109602,Phase 1/Phase 2,NA,Interventional,47,Completed,1,FALSE,U.S. Fed,Public,Other,other,other,TRUE,1,TRUE,Non-race specific,Non-race specific,2010,1,Non-Drug Intervention,Non-Industry Sponsor,Non-Race Specific
Double Blind Study of Hypertonic Saline vs Mannitol in the Management of Increased Intracranial Pressure (ICP).,4/22/2010,3/31/2017,1/31/2012,Jan-12,NCT01108744,Not Applicable,NA,Interventional,0,Withdrawn,1,FALSE,Other,Other,"Drug, Drug",Drug,Pharmaceutical,FALSE,7,TRUE,Non-race specific,Non-race specific,2010,1,Drug Intervention,Non-Industry Sponsor,Non-Race Specific
"A Double-Blind, Placebo-Controlled, Crossover Evaluation of a Grape Seed Extract and Quercetin Supplement (Provex CV) to Reduce Markers of Inflammatory Cytokines and Blood Pressure in Subjects With Metabolic Syndrome",4/19/2010,1/31/2015,3/31/2010,Mar-10,NCT01106170,Phase 1,NA,Interventional,20,Completed,1,FALSE,Other,Other,"Drug, Other",Drug,Pharmaceutical,FALSE,NA,FALSE,Non-race specific,Non-race specific,2010,2,Drug Intervention,Non-Industry Sponsor,Non-Race Specific
Making Accurate Problem Lists in the EHR,4/19/2010,1/31/2015,5/31/2010,May-10,NCT01105923,Not Applicable,"Active, not recruiting",Interventional,140,Unknown status,1,FALSE,Other,Other,Other,other,other,FALSE,NA,FALSE,Non-race specific,Non-race specific,2010,1,Non-Drug Intervention,Non-Industry Sponsor,Non-Race Specific
An Enhanced Medication Monitoring Program,4/16/2010,11/30/2011,9/30/2011,Sep-11,NCT01105104,Phase 1,Recruiting,Interventional,150,Unknown status,1,FALSE,Industry,Industry,"Device, Device",Device,Device,FALSE,NA,FALSE,Non-race specific,Non-race specific,2010,1,Non-Drug Intervention,Industry Sponsor,Non-Race Specific
NA,4/8/2010,4/30/2019,5/1/2010,1-May-10,NCT01099774,Phase 3,NA,Interventional,597,Completed,1,FALSE,Industry,Industry,"Drug, Drug",Drug,Pharmaceutical,TRUE,1,TRUE,Non-race specific,Non-race specific,2010,2,Drug Intervention,Industry Sponsor,Non-Race Specific
"Phase II: Healthy Bodies, Hearts After Menopause",4/6/2010,5/31/2014,6/30/2009,Jun-09,NCT01099007,Phase 1,NA,Interventional,99,Completed,1,FALSE,NIH,Public,"Behavioral, Behavioral",Behavioral,Behavioral,FALSE,NA,FALSE,Non-race specific,Non-race specific,2010,2,Non-Drug Intervention,Non-Industry Sponsor,Non-Race Specific
A Randomized Evaluation of the Effects of Valsartan and Aliskiren in Combination Versus Tekturna Alone on Hemostatic Biomarkers in Patients With Newly Diagnosed Mild to Moderate Hypertension and Type 2 Diabetes Mellitus,3/30/2010,3/31/2010,3/31/2010,Mar-10,NCT01095822,Phase 4,"Active, not recruiting",Interventional,50,Unknown status,1,FALSE,Industry,Industry,Drug,Drug,Pharmaceutical,FALSE,NA,FALSE,Non-race specific,Non-race specific,2010,1,Drug Intervention,Industry Sponsor,Non-Race Specific
An Open Label Pilot Study Evaluating Preliminary Safety and Performance of the GeNO Nitrosyl Delivery System,3/25/2010,4/30/2013,10/31/2010,Oct-10,NCT01092559,Phase 2,NA,Interventional,10,Completed,3,TRUE,Industry,Industry,Drug,Drug,Pharmaceutical,TRUE,NA,FALSE,Non-race specific,Non-race specific,2010,2,Drug Intervention,Industry Sponsor,Non-Race Specific
Community-based Approaches to Treating Hypertension and Colon Cancer Prevention,3/24/2010,4/30/2015,5/31/2010,May-10,NCT01092078,Not Applicable,NA,Interventional,740,Completed,1,FALSE,Other,Other,"Behavioral, Behavioral",Behavioral,Behavioral,FALSE,1,TRUE,African American,Race-specific,2010,1,Non-Drug Intervention,Non-Industry Sponsor,Non-Race Specific
Evaluating the Impact of Computerized Decision Support on Racial/Ethnic Disparities in Hypertension Outcomes,3/10/2010,6/30/2011,10/31/2010,Oct-10,NCT01083940,Early Phase 1,"Active, not recruiting",Interventional,3600,Unknown status,1,FALSE,Other,Other,Other,other,other,FALSE,NA,FALSE,Non-race specific,Non-race specific,2010,1,Non-Drug Intervention,Non-Industry Sponsor,Non-Race Specific
Comparative Blood Pressure Effects of Nebivolol Versus Lisinopril in Patients With New Onset or Exacerbated Hypertension Induced by Bevacizumab: a Crossover Study,2/25/2010,4/30/2012,2/28/2010,Feb-10,NCT01076140,Not Applicable,NA,Interventional,0,Withdrawn,1,FALSE,Other,Other,"Drug, Drug",Drug,Pharmaceutical,FALSE,NA,FALSE,Non-race specific,Non-race specific,2010,2,Drug Intervention,Non-Industry Sponsor,Non-Race Specific
Potassium-Magnesium Citrate as a Blood Pressure Lowering Agent in Hypertensive Patients; Role of Natriuresis,2/24/2010,2/28/2019,9/30/2009,Sep-09,NCT01074918,Phase 1/Phase 2,NA,Interventional,0,Withdrawn,2,TRUE,Other,Other,"Drug, Drug",Drug,Pharmaceutical,FALSE,NA,FALSE,Non-race specific,Non-race specific,2010,2,Drug Intervention,Non-Industry Sponsor,Non-Race Specific
"The Pharmacodynamics, Safety, and Pharmacokinetics of Sedation With Dexmedetomidine in Children Undergoing Hemodynamic Cardiac Catheterization With Special Reference to the Pulmonary Vascular Bed",2/22/2010,4/30/2019,3/31/2010,Mar-10,NCT01072643,Phase 2/Phase 3,NA,Interventional,4,Terminated,1,FALSE,Other,Other,Drug,Drug,Pharmaceutical,TRUE,NA,FALSE,Non-race specific,Non-race specific,2010,2,Drug Intervention,Non-Industry Sponsor,Non-Race Specific
Practice-based Trial of Blood Pressure Control in African Americans,2/17/2010,11/30/2013,2/28/2010,Feb-10,NCT01070056,Phase 3,NA,Interventional,194,Completed,4,TRUE,Other,Other,"Behavioral, Behavioral",Behavioral,Behavioral,FALSE,NA,FALSE,African American,Race-specific,2010,2,Non-Drug Intervention,Non-Industry Sponsor,Non-Race Specific
Vitamin D Deficiency Augments Renin-Angiotensin System Activity in Obesity,2/15/2010,3/31/2017,2/28/2010,Feb-10,NCT01068418,Not Applicable,NA,Interventional,26,Completed,1,FALSE,Other,Other,Dietary Supplement,other,other,TRUE,NA,FALSE,Non-race specific,Non-race specific,2010,2,Non-Drug Intervention,Non-Industry Sponsor,Non-Race Specific
Faith-based Approaches in the Treatment of Hypertension (FAITH),2/9/2010,2/29/2016,11/30/2010,Nov-10,NCT01065831,Not Applicable,NA,Interventional,373,Completed,1,FALSE,NIH,Public,Behavioral,Behavioral,Behavioral,FALSE,NA,FALSE,African American,Race-specific,2010,2,Non-Drug Intervention,Non-Industry Sponsor,Non-Race Specific
A Comparison of Ketofol (Ketamine and Propofol Admixture) vs. Propofol as Induction Agents on Hemodynamic Parameters,2/9/2010,3/31/2013,12/31/2010,Dec-10,NCT01065350,Not Applicable,NA,Interventional,85,Completed,1,FALSE,Other,Other,"Drug, Drug",Drug,Pharmaceutical,TRUE,1,TRUE,Non-race specific,Non-race specific,2010,1,Drug Intervention,Non-Industry Sponsor,Non-Race Specific
"A Randomized, Open-Label, Dose Escalation Study of Bevacizumab With Ambulatory Blood Pressure Monitoring in Previously Untreated Patients With Advanced Non-squamous Non-Small Cell Lung Cancer",2/5/2010,10/31/2019,3/31/2010,Mar-10,NCT01063283,Not Applicable,NA,Interventional,20,Completed,3,TRUE,Industry,Industry,"Drug, Drug, Drug, Drug",Drug,Pharmaceutical,TRUE,NA,FALSE,Non-race specific,Non-race specific,2010,2,Drug Intervention,Industry Sponsor,Non-Race Specific
Acute Hemodynamic Effects of Sildenafil in Patients With Severe Aortic Stenosis,2/1/2010,4/30/2018,1/31/2010,Jan-10,NCT01060020,Phase 4,NA,Interventional,20,Completed,1,FALSE,Other,Other,Drug,Drug,Pharmaceutical,TRUE,1,TRUE,Non-race specific,Non-race specific,2010,1,Drug Intervention,Non-Industry Sponsor,Non-Race Specific
"Randomized, Double-blind, Placebo-controlled, Parallel-group Study to Evaluate the Effect of 5 mg or 20 mg Nebivolol Once Daily on Blood Pressure in Patients With Systolic Stage 2 Hypertension",1/27/2010,12/31/2011,3/31/2010,Mar-10,NCT01057251,Phase 4,NA,Interventional,433,Completed,36,TRUE,Industry,Industry,"Drug, Drug",Drug,Pharmaceutical,TRUE,NA,FALSE,Non-race specific,Non-race specific,2010,2,Drug Intervention,Industry Sponsor,Non-Race Specific
Effects of Nebivolol on Exercise Tolerance and Left Ventricular Systolic and Diastolic Function,1/26/2010,3/31/2017,11/30/2009,Nov-09,NCT01056718,Not Applicable,NA,Interventional,53,Completed,1,FALSE,Industry,Industry,Drug,Drug,Pharmaceutical,TRUE,1,TRUE,Non-race specific,Non-race specific,2010,1,Drug Intervention,Industry Sponsor,Non-Race Specific
Improving Blood Pressure Control in End-Stage Renal Disease Through a Supportive-Educative Nursing Intervention,1/20/2010,11/30/2017,6/30/2009,Jun-09,NCT01052220,Not Applicable,NA,Interventional,118,Completed,2,TRUE,Other,Other,"Behavioral, Behavioral",Behavioral,Behavioral,FALSE,NA,FALSE,Non-race specific,Non-race specific,2010,2,Non-Drug Intervention,Non-Industry Sponsor,Non-Race Specific
Impact of Nebivolol on Central Aortic Pressure,1/20/2010,7/31/2011,12/31/2009,Dec-09,NCT01051947,Not Applicable,NA,Interventional,0,Withdrawn,1,FALSE,Other,Other,"Drug, Drug",Drug,Pharmaceutical,FALSE,NA,FALSE,Non-race specific,Non-race specific,2010,2,Drug Intervention,Non-Industry Sponsor,Non-Race Specific
The Effect of Nebivolol on Endothelial Dysfunction in African Americans With Hypertension,1/14/2010,3/31/2017,12/31/2009,Dec-09,NCT01049009,Phase 4,NA,Interventional,91,Completed,1,FALSE,Industry,Industry,"Drug, Drug",Drug,Pharmaceutical,TRUE,1,TRUE,African American,Race-specific,2010,1,Drug Intervention,Industry Sponsor,Non-Race Specific
Randomized Trial to Compare Surgical and Medical Treatments for Type 2 Diabetes (Triabetes) - Alliance of Randomized Trials of Medicine vs. Metabolic Surgery in Type 2 Diabetes ARMMST2D),1/13/2010,7/31/2019,9/30/2009,Sep-09,NCT01047735,Not Applicable,NA,Interventional,60,"Active, not recruiting",1,FALSE,NIH,Public,"Procedure, Procedure, Behavioral",Procedure,Procedure,FALSE,NA,FALSE,Non-race specific,Non-race specific,2010,2,Non-Drug Intervention,Non-Industry Sponsor,Non-Race Specific
Effect of Nebivolol on Blood Pressure in a Model of Hypertension Sensitive to Potentiation of Nitric Oxide Bioactivity,1/8/2010,4/30/2015,1/31/2010,Jan-10,NCT01044693,Not Applicable,NA,Interventional,20,Completed,1,FALSE,Industry,Industry,"Drug, Drug, Drug, Drug",Drug,Pharmaceutical,TRUE,6,TRUE,Non-race specific,Non-race specific,2010,1,Drug Intervention,Industry Sponsor,Non-Race Specific
The Efficacy and Safety of Cleviprex in Ventriculostomy Patients Requiring IV Antihypertensive Therapy Investigator Initiated Trial,1/5/2010,3/31/2018,5/31/2010,May-10,NCT01042574,Phase 4,NA,Interventional,0,Withdrawn,1,FALSE,Industry,Industry,Drug,Drug,Pharmaceutical,FALSE,1,TRUE,Non-race specific,Non-race specific,2010,1,Drug Intervention,Industry Sponsor,Non-Race Specific
Effect of Nebivolol on Oxidative Stress and Endothelial Progenitor Cells in Subjects With Hypertension,12/31/2009,12/31/2014,12/31/2009,Dec-09,NCT01041287,Phase 4,NA,Interventional,96,Completed,1,FALSE,Industry,Industry,"Drug, Drug",Drug,Pharmaceutical,TRUE,NA,FALSE,Non-race specific,Non-race specific,2009,2,Drug Intervention,Industry Sponsor,Non-Race Specific
Improving Care Transitions for Complex Patients Through Decision Support,12/24/2009,2/28/2014,12/31/2009,Dec-09,NCT01039324,Not Applicable,NA,Interventional,8422,Completed,1,FALSE,Other,Other,"Other, Other, Other",other,other,FALSE,NA,FALSE,Non-race specific,Non-race specific,2009,2,Non-Drug Intervention,Non-Industry Sponsor,Non-Race Specific
Melatonin Supplementation and the Metabolic Syndrome: A Phase II Crossover Design Clinical Trial,12/24/2009,2/28/2015,7/31/2009,Jul-09,NCT01038921,Phase 2,NA,Interventional,39,Completed,2,TRUE,Other,Other,"Drug, Drug",Drug,Pharmaceutical,TRUE,NA,FALSE,Non-race specific,Non-race specific,2009,2,Drug Intervention,Non-Industry Sponsor,Non-Race Specific
An Intervention to Improve Communication Between Physicians and Minority Patients With Hypertension,12/23/2009,7/31/2012,1/31/2010,Jan-10,NCT01037920,Not Applicable,NA,Interventional,179,Completed,1,FALSE,Other,Other,"Behavioral, Behavioral",Behavioral,Behavioral,FALSE,NA,FALSE,Non-race specific,Non-race specific,2009,2,Non-Drug Intervention,Non-Industry Sponsor,Non-Race Specific
Effect of a Novel Behavioral Intervention on Blood Pressure Control in Hypertension Patients,12/18/2009,11/30/2013,5/31/2010,May-10,NCT01035554,Phase 2/Phase 3,NA,Interventional,203,Completed,1,FALSE,NIH,Public,"Other, Other, Other, Other",other,other,FALSE,NA,FALSE,Non-race specific,Non-race specific,2009,2,Non-Drug Intervention,Non-Industry Sponsor,Non-Race Specific
A Safety and Efficacy Study of Blood Pressure Control in Acute Aortic Emergencies - A Pilot Study (PROMPT),12/16/2009,8/31/2018,11/30/2009,Nov-09,NCT01033370,Phase 4,NA,Interventional,5,Terminated,1,FALSE,Industry,Industry,Drug,Drug,Pharmaceutical,FALSE,10,TRUE,Non-race specific,Non-race specific,2009,1,Drug Intervention,Industry Sponsor,Non-Race Specific
Effect of Treatment of Orthostatic Hypotension on a Rehabilitation Unit,12/14/2009,7/31/2018,10/31/2011,Oct-11,NCT01030874,Not Applicable,NA,Interventional,356,Completed,1,FALSE,U.S. Fed,Public,"Other, Dietary Supplement, Other, Other, Drug",Drug,Pharmaceutical,FALSE,NA,FALSE,Non-race specific,Non-race specific,2009,2,Drug Intervention,Non-Industry Sponsor,Non-Race Specific
Use of PAP in Women With Pre-eclampsia,12/10/2009,9/30/2017,5/31/2009,May-09,NCT01029691,Not Applicable,NA,Interventional,125,Completed,1,FALSE,NIH,Public,Device,Device,Device,TRUE,1,TRUE,Non-race specific,Non-race specific,2009,1,Non-Drug Intervention,Non-Industry Sponsor,Non-Race Specific
"A Prospective, Single-center Investigation of the Safety and Performance of the Endo GIA™ Stapler With Endo GIA™ Sulu With Tri-Staple™ Technology in a Gastric Bypass Procedure",12/4/2009,1/31/2014,1/31/2010,Jan-10,NCT01026103,Not Applicable,NA,Interventional,28,Completed,1,FALSE,Industry,Industry,Device,Device,Device,TRUE,NA,FALSE,Non-race specific,Non-race specific,2009,2,Non-Drug Intervention,Industry Sponsor,Non-Race Specific
Trial Using Motivational Interviewing Positive Affect and Self-Affirmation in Hypertension (TRIUMPH),12/3/2009,2/28/2017,1/31/2010,Jan-10,NCT01024933,Not Applicable,NA,Interventional,238,Completed,1,FALSE,NIH,Public,"Behavioral, Behavioral",Behavioral,Behavioral,FALSE,NA,FALSE,Non-race specific,Non-race specific,2009,2,Non-Drug Intervention,Non-Industry Sponsor,Non-Race Specific
Upper Cervical Manipulation for Patients With Stage 1 Hypertension,11/25/2009,1/31/2018,10/31/2010,Oct-10,NCT01020435,Not Applicable,NA,Interventional,51,Completed,1,FALSE,Other,Other,"Other, Other",other,other,TRUE,4,TRUE,Non-race specific,Non-race specific,2009,1,Non-Drug Intervention,Non-Industry Sponsor,Non-Race Specific
NA,11/19/2009,2/28/2015,10/31/2009,Oct-09,NCT01016691,Phase 2,NA,Interventional,47,Completed,5,TRUE,Industry,Industry,"Drug, Drug, Drug, Drug",Drug,Pharmaceutical,TRUE,NA,FALSE,Non-race specific,Non-race specific,2009,3,Drug Intervention,Industry Sponsor,Non-Race Specific
"A Multi-center, Randomized, Controlled and Prospective Pilot Study on the Effects of Intensified Sodium Management on Hospitalization in Chronic Hemodialysis Patients.",11/18/2009,9/30/2015,11/30/2009,Nov-09,NCT01015313,Not Applicable,NA,Interventional,0,Withdrawn,3,TRUE,Other,Other,Other,other,other,FALSE,NA,FALSE,Non-race specific,Non-race specific,2009,2,Non-Drug Intervention,Non-Industry Sponsor,Non-Race Specific
Treating to Target for Patients With Hypertension,11/16/2009,11/30/2012,1/31/2009,Jan-09,NCT01013857,Not Applicable,NA,Interventional,240,Completed,1,FALSE,Other,Other,"Behavioral, Behavioral",Behavioral,Behavioral,FALSE,NA,FALSE,Non-race specific,Non-race specific,2009,2,Non-Drug Intervention,Non-Industry Sponsor,Non-Race Specific
Music as an Auxiliary Analgesic and Anxiolytic During First Trimester Abortion,11/13/2009,11/30/2012,9/30/2009,Sep-09,NCT01013363,Not Applicable,NA,Interventional,106,Completed,1,FALSE,Other,Other,Other,other,other,FALSE,1,TRUE,Non-race specific,Non-race specific,2009,1,Non-Drug Intervention,Non-Industry Sponsor,Non-Race Specific
Reduction of Nocturnal Hypertension in Pediatric Renal Transplant Recipients,11/5/2009,5/31/2019,11/30/2009,Nov-09,NCT01007994,Phase 2/Phase 3,NA,Interventional,33,"Active, not recruiting",2,TRUE,Other,Other,Drug,Drug,Pharmaceutical,FALSE,NA,FALSE,Non-race specific,Non-race specific,2009,2,Drug Intervention,Non-Industry Sponsor,Non-Race Specific
"Cardiovascular Fixed Dose Combination Pill: A Pharmacodynamic Interaction Study to Evaluate the Effect of a Fixed Dose Combination of Acetylsalicylic Acid, Simvastatin and Ramipril (Cardiovascular Fixed Dose Combination Pill) on Blood Pressure",10/30/2009,6/30/2012,10/31/2009,Oct-09,NCT01005290,Phase 2,NA,Interventional,38,Terminated,1,FALSE,Industry,Industry,"Drug, Drug",Drug,Pharmaceutical,TRUE,NA,FALSE,Non-race specific,Non-race specific,2009,2,Drug Intervention,Industry Sponsor,Non-Race Specific
NA,10/26/2009,8/31/2013,11/30/2009,Nov-09,NCT01001195,Phase 2,NA,Interventional,165,Completed,1,FALSE,Industry,Industry,"Drug, Drug, Drug, Drug",Drug,Pharmaceutical,TRUE,NA,FALSE,Non-race specific,Non-race specific,2009,3,Drug Intervention,Industry Sponsor,Non-Race Specific
"A 25 Week, Open Label Study to Determine the Effects of Nebivolol When Added to Hydrochlorothiazide on Diastolic Function and Arterial Stiffness in African Americans With Hypertension",10/22/2009,5/31/2011,10/31/2009,Oct-09,NCT00999752,Not Applicable,NA,Interventional,40,Completed,1,FALSE,Industry,Industry,"Drug, Drug",Drug,Pharmaceutical,FALSE,NA,FALSE,African American,Race-specific,2009,2,Drug Intervention,Industry Sponsor,Non-Race Specific
Nebivolol Vs. Metoprolol: Comparative Effects on Fatigue and Quality of Life,10/21/2009,10/31/2018,10/31/2009,Oct-09,NCT00999102,Phase 4,NA,Interventional,37,Completed,1,FALSE,Industry,Industry,"Drug, Drug",Drug,Pharmaceutical,TRUE,NA,FALSE,Non-race specific,Non-race specific,2009,2,Drug Intervention,Industry Sponsor,Non-Race Specific
Comparative Effects of Nebivolol and Metoprolol on Female Sexual Function,10/14/2009,3/31/2019,10/31/2009,Oct-09,NCT00995072,Not Applicable,NA,Interventional,29,Completed,1,FALSE,Other,Other,"Drug, Drug",Drug,Pharmaceutical,TRUE,NA,FALSE,Non-race specific,Non-race specific,2009,2,Drug Intervention,Non-Industry Sponsor,Non-Race Specific
"A Prospective, Randomized, Open-label Clinical Trial to Evaluate the Effect of Tekturna (Aliskiren), Angiotensin Inhibitors, Diuretics, and Calcium Channel Blockers on Coronary Flow Reserve in Patients With Type II Diabetes and Hypertension",10/14/2009,9/30/2017,8/31/2009,Aug-09,NCT00994253,Phase 4,NA,Interventional,0,Withdrawn,1,FALSE,Industry,Industry,"Drug, Drug",Drug,Pharmaceutical,FALSE,NA,FALSE,Non-race specific,Non-race specific,2009,2,Drug Intervention,Industry Sponsor,Non-Race Specific
Technologies for Enhancing Access and Health Management,9/30/2009,5/31/2010,10/31/2009,Oct-09,NCT00987025,Not Applicable,"Active, not recruiting",Interventional,144,Unknown status,4,TRUE,Industry,Industry,"Behavioral, Behavioral",Behavioral,Behavioral,FALSE,NA,FALSE,Non-race specific,Non-race specific,2009,1,Non-Drug Intervention,Industry Sponsor,Non-Race Specific
