official_title,study_first_posted_date,verification_date,start_date,start_month_year,nct_id,phase,last_known_status,study_type,enrollment,overall_status,facilitiesCount,multisite,funding,fundingComb,intervention_comb,interventionType,interventionTypeCombined,were_results_reported,pubCount,pubCountBool,diverse,diverseGroup,yearStart,numMissing,interventionDrugNonDrug,industryNonIndustry,raceSpecific
"A Double-blind, Randomized, Parallel 2- Arm Study to Compare the Efficacy of Ertugliflozin Versus Hydrochlorothiazide in Reducing Sympathetic Neural Overactivity in Patients With Hypertension and Recently-diagnosed Type 2 Diabetes Who Are Receiving Background Standard-of-care Cardio-metabolic Therapy With Metformin, an Angiotensin Converting Enzyme Inhibitor or Angiotensin Receptor Blocker, and a Statin.",8/21/2018,8/31/2018,9/1/2018,1-Sep-18,NCT03640221,Phase 4,NA,Interventional,0,Withdrawn,1,FALSE,Industry,Industry,"Drug, Drug, Device, Other, Other, Other, Other",Device,Device,FALSE,NA,FALSE,Non-race specific,Non-race specific,2018,2,Drug Intervention,Industry Sponsor,Non-Race Specific
"Psychological Stress, and Circadian Patterns of Sodium Excretion and Blood Pressure",8/17/2018,9/30/2019,11/16/2018,16-Nov-18,NCT03636490,Not Applicable,NA,Interventional,211,Recruiting,1,FALSE,NIH,Public,Behavioral,Behavioral,Behavioral,FALSE,NA,FALSE,Non-race specific,Non-race specific,2018,2,Non-Drug Intervention,Non-Industry Sponsor,Non-Race Specific
"A Prospective, Randomized, Open-Label, Active-Comparator, Blinded-Endpoint, 12-week Forced-Titration Study of the Efficacy and Safety of Nebivolol Verses Metoprolol in Hypertensive Subjects Taking Amlodipine",8/17/2018,8/31/2018,8/30/2010,30-Aug-10,NCT03635125,Phase 4,NA,Interventional,40,Completed,1,FALSE,Other,Other,"Drug, Drug, Other",Drug,Pharmaceutical,FALSE,NA,FALSE,Non-race specific,Non-race specific,2018,2,Drug Intervention,Non-Industry Sponsor,Non-Race Specific
Perioperative Blood Pressure Screening to Improve Long-term Cardiovascular Health,8/16/2018,1/31/2019,8/31/2018,31-Aug-18,NCT03634813,Phase 2,NA,Interventional,60,Recruiting,1,FALSE,Other,Other,"Device, Procedure",Procedure,Procedure,FALSE,NA,FALSE,Non-race specific,Non-race specific,2018,2,Non-Drug Intervention,Non-Industry Sponsor,Non-Race Specific
Autologous Stem Cell Transplantation With CD34-Selected Peripheral Blood Stem Cells (PBSC) in Patients With Treatment Resistant Systemic Sclerosis (SSc),8/14/2018,4/30/2019,7/31/2018,31-Jul-18,NCT03630211,Phase 2,NA,Interventional,8,Recruiting,3,TRUE,Other,Other,"Drug, Drug, Drug, Drug, Drug, Drug, Drug, Radiation",Drug,Pharmaceutical,FALSE,NA,FALSE,Non-race specific,Non-race specific,2018,2,Drug Intervention,Non-Industry Sponsor,Non-Race Specific
"Bingocize: A Novel Mobile Application to Help Maintain or Improve Older Adults' Health, Function, and Cognition",8/14/2018,10/31/2018,8/14/2018,14-Aug-18,NCT03629912,Not Applicable,NA,Interventional,160,Recruiting,4,TRUE,NIH,Public,Behavioral,Behavioral,Behavioral,FALSE,NA,FALSE,Non-race specific,Non-race specific,2018,2,Non-Drug Intervention,Non-Industry Sponsor,Non-Race Specific
Accuracy of Non-invasive Non-oscillometric Blood Pressure Wristband,8/14/2018,4/30/2019,4/1/2019,1-Apr-19,NCT03629535,Not Applicable,NA,Interventional,15,Recruiting,1,FALSE,Other,Other,"Device, Device",Device,Device,FALSE,NA,FALSE,Non-race specific,Non-race specific,2018,2,Non-Drug Intervention,Non-Industry Sponsor,Non-Race Specific
"Randomized, Active-Control Study to Determine the Effect of Mindfulness-Based Stress Reduction on Sympathetic Activity and Arterial Stiffness",8/13/2018,11/30/2018,9/4/2018,4-Sep-18,NCT03626363,Not Applicable,NA,Interventional,60,Recruiting,1,FALSE,Other,Other,Behavioral,Behavioral,Behavioral,FALSE,NA,FALSE,Non-race specific,Non-race specific,2018,2,Non-Drug Intervention,Non-Industry Sponsor,Non-Race Specific
Mechanical Ventilation Guided By Transpulmonary and Airway Driving Pressures in the Setting of Intra-abdominal Hypertension,8/10/2018,4/30/2019,3/13/2018,13-Mar-18,NCT03624491,Not Applicable,NA,Interventional,50,Enrolling by invitation,1,FALSE,Other,Other,Other,other,other,FALSE,NA,FALSE,Non-race specific,Non-race specific,2018,2,Non-Drug Intervention,Non-Industry Sponsor,Non-Race Specific
Effects of Inorganic Nitrate Supplementation on Cerebrovascular Aging and Arterial Stiffness Study,8/6/2018,1/31/2020,11/1/2018,1-Nov-18,NCT03617302,Early Phase 1,NA,Interventional,18,Recruiting,1,FALSE,Other,Other,"Drug, Drug",Drug,Pharmaceutical,FALSE,NA,FALSE,Non-race specific,Non-race specific,2018,2,Drug Intervention,Non-Industry Sponsor,Non-Race Specific
Innovation in Postpartum Care for Women With Hypertensive Disorders of Pregnancy: A Randomized Trial of Home- Versus Office-Based Blood Pressure Monitoring,8/3/2018,10/31/2019,9/1/2018,1-Sep-18,NCT03613714,Not Applicable,NA,Interventional,100,Recruiting,1,FALSE,Other,Other,Other,other,other,FALSE,NA,FALSE,Non-race specific,Non-race specific,2018,2,Non-Drug Intervention,Non-Industry Sponsor,Non-Race Specific
Response of the Gut Microbiome and Circulating Metabolome to Diet Intervention in Young Children: Ancillary Study to the Keeping Ideal Cardiovascular Health Family Intervention Trial (KIDFIT),8/2/2018,10/31/2019,7/10/2018,10-Jul-18,NCT03612479,Not Applicable,NA,Interventional,112,Enrolling by invitation,1,FALSE,NIH,Public,"Behavioral, Behavioral",Behavioral,Behavioral,FALSE,NA,FALSE,Non-race specific,Non-race specific,2018,2,Non-Drug Intervention,Non-Industry Sponsor,Non-Race Specific
mGlide RCT: A Clinical Glide Path To Close the Guideline-to-Practice Gap In HTN Management,8/2/2018,10/31/2019,3/1/2019,1-Mar-19,NCT03612271,Not Applicable,NA,Interventional,450,Recruiting,1,FALSE,NIH,Public,Behavioral,Behavioral,Behavioral,FALSE,NA,FALSE,Non-race specific,Non-race specific,2018,2,Non-Drug Intervention,Non-Industry Sponsor,Non-Race Specific
The Role of Acumen Hypotension Prediction Index Software in Hypotension Management During Moderate to High-Risk Noncardiac Surgery: A Pilot Randomized Control Trial,8/1/2018,9/30/2019,7/12/2018,12-Jul-18,NCT03610165,Not Applicable,NA,Interventional,213,"Active, not recruiting",1,FALSE,Other,Other,"Device, Device",Device,Device,FALSE,NA,FALSE,Non-race specific,Non-race specific,2018,2,Non-Drug Intervention,Non-Industry Sponsor,Non-Race Specific
Cardiovascular Effects of Angiotensin 1-7 in Obesity Hypertension,7/27/2018,1/31/2020,4/1/2019,1-Apr-19,NCT03604289,Early Phase 1,NA,Interventional,24,Recruiting,1,FALSE,Other,Other,"Drug, Drug",Drug,Pharmaceutical,FALSE,NA,FALSE,Non-race specific,Non-race specific,2018,2,Drug Intervention,Non-Industry Sponsor,Non-Race Specific
An Open-Label Extension Study of the Safety of Relacorilant in the Treatment of the Signs and Symptoms of Cushing Syndrome,7/27/2018,7/31/2018,5/7/2018,7-May-18,NCT03604198,Phase 2,NA,Interventional,75,Recruiting,2,TRUE,Industry,Industry,Drug,Drug,Pharmaceutical,FALSE,NA,FALSE,Non-race specific,Non-race specific,2018,2,Drug Intervention,Industry Sponsor,Non-Race Specific
Cardiovascular Effects of High-Intensity Interval Training (HIIT) and Moderate-Intensity Continuous Training (MCT),7/26/2018,4/30/2019,3/30/2017,30-Mar-17,NCT03602170,Not Applicable,NA,Interventional,20,Completed,1,FALSE,Other,Other,"Behavioral, Behavioral",Behavioral,Behavioral,FALSE,NA,FALSE,Non-race specific,Non-race specific,2018,2,Non-Drug Intervention,Non-Industry Sponsor,Non-Race Specific
Short Message Service System for Patients With Uncontrolled Hypertension,7/23/2018,11/30/2019,3/31/2020,Mar-20,NCT03596242,Not Applicable,NA,Interventional,20,Not yet recruiting,1,FALSE,Other,Other,Other,other,other,FALSE,1,TRUE,Non-race specific,Non-race specific,2018,1,Non-Drug Intervention,Non-Industry Sponsor,Non-Race Specific
Rice Vinegar as an Intervention to Lower Blood Pressure in Adults With Prehypertension and 10-year CVD Risk <10%,7/23/2018,7/31/2019,9/11/2018,11-Sep-18,NCT03596099,Not Applicable,NA,Interventional,130,"Active, not recruiting",2,TRUE,Industry,Industry,"Dietary Supplement, Dietary Supplement",other,other,FALSE,12,TRUE,Non-race specific,Non-race specific,2018,1,Non-Drug Intervention,Industry Sponsor,Non-Race Specific
Is Procardia XL 60 mg Q Daily Equivalent to 30 mg XL Given Twice Daily?,7/23/2018,3/31/2019,9/15/2018,15-Sep-18,NCT03595982,Phase 4,NA,Interventional,20,Recruiting,1,FALSE,Other,Other,"Drug, Drug",Drug,Pharmaceutical,FALSE,5,TRUE,Non-race specific,Non-race specific,2018,1,Drug Intervention,Non-Industry Sponsor,Non-Race Specific
Virtual Visits at Brigham and Women's Hospital: A Randomized Controlled Trial,7/19/2018,8/31/2019,4/13/2018,13-Apr-18,NCT03592355,Not Applicable,NA,Interventional,200,Enrolling by invitation,1,FALSE,Other,Other,Other,other,other,FALSE,3,TRUE,Non-race specific,Non-race specific,2018,1,Non-Drug Intervention,Non-Industry Sponsor,Non-Race Specific
Modulating Celecoxib Induced Blood Pressure Changes by Timed Administration of Aspirin and the Human Chronobiome,7/18/2018,1/31/2020,11/30/2020,Nov-20,NCT03590821,Early Phase 1,NA,Interventional,60,Not yet recruiting,1,FALSE,Other,Other,"Drug, Drug",Drug,Pharmaceutical,FALSE,1,TRUE,Non-race specific,Non-race specific,2018,1,Drug Intervention,Non-Industry Sponsor,Non-Race Specific
Central & Peripheral Blood Flow Regulations in Individuals With Down Syndrome,7/18/2018,7/31/2019,3/1/2018,1-Mar-18,NCT03590665,Not Applicable,NA,Interventional,21,Terminated,1,FALSE,NIH,Public,Other,other,other,FALSE,NA,FALSE,Non-race specific,Non-race specific,2018,2,Non-Drug Intervention,Non-Industry Sponsor,Non-Race Specific
Assess the Accuracy of Transtek TMB-1591-A-002 Blood Pressure Monitor in Conformance With the ANSI/AAMI ISO 81060-2 Standard,7/17/2018,7/31/2018,5/30/2017,30-May-17,NCT03588559,Not Applicable,NA,Interventional,88,Completed,1,FALSE,Industry,Industry,Diagnostic Test,other,other,FALSE,NA,FALSE,Non-race specific,Non-race specific,2018,2,Non-Drug Intervention,Industry Sponsor,Non-Race Specific
Daily Intake of Cocoa Flavanols and Arterial Stiffness in Humans,7/16/2018,3/31/2019,3/23/2018,23-Mar-18,NCT03587883,Not Applicable,NA,Interventional,30,Recruiting,1,FALSE,Industry,Industry,"Other, Other, Other, Other",other,other,FALSE,1,TRUE,Non-race specific,Non-race specific,2018,1,Non-Drug Intervention,Industry Sponsor,Non-Race Specific
Adiposity and Endothelin Receptor Function,7/12/2018,10/31/2019,5/21/2018,21-May-18,NCT03583866,Early Phase 1,NA,Interventional,200,Recruiting,1,FALSE,NIH,Public,"Drug, Drug",Drug,Pharmaceutical,FALSE,NA,FALSE,Non-race specific,Non-race specific,2018,2,Drug Intervention,Non-Industry Sponsor,Non-Race Specific
An Interactive Technology Enhanced Coaching Intervention for Black Women With Hypertension,7/5/2018,12/31/2019,1/28/2019,28-Jan-19,NCT03577990,Not Applicable,NA,Interventional,90,"Active, not recruiting",1,FALSE,NIH,Public,"Behavioral, Behavioral",Behavioral,Behavioral,FALSE,NA,FALSE,African American,Race-specific,2018,2,Non-Drug Intervention,Non-Industry Sponsor,Non-Race Specific
Treatment of Delayed Pulmonary Transition in Extremely Preterm Infants & Bronchopulmonary Dysplasia,7/3/2018,8/31/2019,7/15/2019,15-Jul-19,NCT03576885,Phase 1/Phase 2,NA,Interventional,138,Recruiting,1,FALSE,Industry,Industry,"Drug, Drug",Drug,Pharmaceutical,FALSE,30,TRUE,Non-race specific,Non-race specific,2018,1,Drug Intervention,Industry Sponsor,Non-Race Specific
Metformin for Preeclampsia Prevention in Pregnant Women With Type 1 Diabetes Mellitus,6/27/2018,7/31/2019,7/8/2019,8-Jul-19,NCT03570632,Phase 4,NA,Interventional,60,Recruiting,1,FALSE,Other,Other,Drug,Drug,Pharmaceutical,FALSE,NA,FALSE,Non-race specific,Non-race specific,2018,2,Drug Intervention,Non-Industry Sponsor,Non-Race Specific
Dietary Approaches to Stop Hypertension (DASH) Diet Effects on Serum Uric Acid (SUA) in Adults With Hyperuricemia and Gout,6/26/2018,11/30/2019,8/7/2018,7-Aug-18,NCT03569020,Not Applicable,NA,Interventional,43,Completed,2,TRUE,Other,Other,Other,other,other,FALSE,NA,FALSE,Non-race specific,Non-race specific,2018,2,Non-Drug Intervention,Non-Industry Sponsor,Non-Race Specific
The Effects of Dietary Salt on Post-exercise Hypotension,6/21/2018,9/30/2019,5/1/2018,1-May-18,NCT03565653,Not Applicable,NA,Interventional,20,Completed,1,FALSE,Other,Other,"Other, Other",other,other,FALSE,NA,FALSE,Non-race specific,Non-race specific,2018,2,Non-Drug Intervention,Non-Industry Sponsor,Non-Race Specific
Effects of Acute Dietary Sodium on Cerebrovascular Reactivity and Blood Pressure Reactivity,6/20/2018,9/30/2019,5/1/2018,1-May-18,NCT03564262,Not Applicable,NA,Interventional,25,Recruiting,1,FALSE,Other,Other,"Other, Other",other,other,FALSE,NA,FALSE,Non-race specific,Non-race specific,2018,2,Non-Drug Intervention,Non-Industry Sponsor,Non-Race Specific
Enhancing Systems of Care to Improve Hypertension Guideline Implementation to Communities With Health Disparities,6/20/2018,2/28/2019,2/28/2019,Feb-19,NCT03563872,Not Applicable,NA,Interventional,0,Withdrawn,1,FALSE,Other,Other,"Other, Other",other,other,FALSE,NA,FALSE,African American,Race-specific,2018,2,Non-Drug Intervention,Non-Industry Sponsor,Non-Race Specific
The Effect of Acute Mild Dehydration on Blood Pressure Control,6/18/2018,9/30/2019,8/8/2017,8-Aug-17,NCT03560869,Not Applicable,NA,Interventional,19,Completed,1,FALSE,Other,Other,Other,other,other,FALSE,NA,FALSE,Non-race specific,Non-race specific,2018,2,Non-Drug Intervention,Non-Industry Sponsor,Non-Race Specific
Sleep and Circadian Mechanisms Contributing to Disparity in Prevalence of Hypertension Between Black and White Americans,6/15/2018,10/31/2019,12/1/2018,1-Dec-18,NCT03558893,Not Applicable,NA,Interventional,52,Recruiting,1,FALSE,Other,Other,Behavioral,Behavioral,Behavioral,FALSE,NA,FALSE,Non-race specific,Non-race specific,2018,2,Non-Drug Intervention,Non-Industry Sponsor,Non-Race Specific
Vascular Responses to Sympathetic Activation and Altered Shear Rate: The Impact of Hypertension and Sodium Intake,6/15/2018,6/30/2019,5/15/2018,15-May-18,NCT03558022,Not Applicable,NA,Interventional,80,Recruiting,1,FALSE,Other,Other,"Dietary Supplement, Dietary Supplement",other,other,FALSE,NA,FALSE,Non-race specific,Non-race specific,2018,2,Non-Drug Intervention,Non-Industry Sponsor,Non-Race Specific
Heat Therapy Versus Exercise Training in Hypertension,6/15/2018,11/30/2019,12/31/2019,Dec-19,NCT03557502,Not Applicable,NA,Interventional,50,Not yet recruiting,1,FALSE,Other,Other,"Other, Other",other,other,FALSE,NA,FALSE,Non-race specific,Non-race specific,2018,2,Non-Drug Intervention,Non-Industry Sponsor,Non-Race Specific
Furosemide for Accelerated Recovery of Blood Pressure Postpartum,6/14/2018,6/30/2019,6/20/2018,20-Jun-18,NCT03556761,Phase 2,NA,Interventional,385,Recruiting,1,FALSE,Other,Other,"Drug, Drug",Drug,Pharmaceutical,FALSE,NA,FALSE,Non-race specific,Non-race specific,2018,2,Drug Intervention,Non-Industry Sponsor,Non-Race Specific
Clinical Evaluation of the Serenity River Stent System to Treat Idiopathic Intracranial Hypertension,6/14/2018,11/30/2018,8/24/2018,24-Aug-18,NCT03556085,Not Applicable,NA,Interventional,39,Recruiting,3,TRUE,Industry,Industry,Device,Device,Device,FALSE,7,TRUE,Non-race specific,Non-race specific,2018,1,Non-Drug Intervention,Industry Sponsor,Non-Race Specific
Effect of Occupational Therapy in Promoting Medication Adherence: A Randomized Control Trial,6/11/2018,6/30/2019,7/1/2018,1-Jul-18,NCT03551925,Not Applicable,NA,Interventional,32,Completed,1,FALSE,Other,Other,"Behavioral, Behavioral",Behavioral,Behavioral,FALSE,1,TRUE,Non-race specific,Non-race specific,2018,1,Non-Drug Intervention,Non-Industry Sponsor,Non-Race Specific
"Effects of Simulated Passive Jogging Device on Glucose Homeostasis, Muscle Strength and Endurance",6/8/2018,4/30/2019,6/5/2018,5-Jun-18,NCT03550105,Not Applicable,NA,Interventional,24,Completed,1,FALSE,Industry,Industry,Device,Device,Device,FALSE,NA,FALSE,Non-race specific,Non-race specific,2018,2,Non-Drug Intervention,Industry Sponsor,Non-Race Specific
Taekwondo Training Reduces Blood Catecholamine Levels and Arterial Stiffness in Postmenopausal Women With Stage-2 Hypertension,6/1/2018,6/30/2019,5/1/2017,1-May-17,NCT03544307,Not Applicable,NA,Interventional,20,Completed,1,FALSE,Other,Other,Behavioral,Behavioral,Behavioral,TRUE,NA,FALSE,Non-race specific,Non-race specific,2018,2,Non-Drug Intervention,Non-Industry Sponsor,Non-Race Specific
Effects of Curcumin Supplementation on Gut Barrier Function in Patients With Metabolic Syndrome,5/31/2018,12/31/2019,9/19/2018,19-Sep-18,NCT03542240,Not Applicable,NA,Interventional,50,Recruiting,1,FALSE,Other,Other,Dietary Supplement,other,other,FALSE,NA,FALSE,Non-race specific,Non-race specific,2018,2,Non-Drug Intervention,Non-Industry Sponsor,Non-Race Specific
The Impact of Blood Flow Restriction (BFR) on Exercise and Hemodynamic Responses,5/30/2018,7/31/2019,1/26/2018,26-Jan-18,NCT03540147,Not Applicable,NA,Interventional,38,Completed,1,FALSE,Other,Other,"Device, Device",Device,Device,FALSE,6,TRUE,Non-race specific,Non-race specific,2018,1,Non-Drug Intervention,Non-Industry Sponsor,Non-Race Specific
Effect of Dietary Approaches to Stop Hypertension Eating Pattern on Cardiometabolic Markers in Advanced Heart Failure Patients,5/29/2018,11/30/2018,11/15/2018,15-Nov-18,NCT03538990,Not Applicable,NA,Interventional,36,Recruiting,1,FALSE,Other,Other,Other,other,other,FALSE,NA,FALSE,Non-race specific,Non-race specific,2018,2,Non-Drug Intervention,Non-Industry Sponsor,Non-Race Specific
Safety and Efficacy of Splenic Artery Embolization to Treat Symptomatic Portal,5/22/2018,10/31/2019,11/1/2018,1-Nov-18,NCT03532750,Not Applicable,NA,Interventional,30,Recruiting,1,FALSE,Other,Other,"Device, Device",Device,Device,FALSE,NA,FALSE,Non-race specific,Non-race specific,2018,2,Non-Drug Intervention,Non-Industry Sponsor,Non-Race Specific
MyLife: A Digital Health Coaching Program Encouraging Healthy Behaviors in Patients at Risk for Lifestyle-related Chronic Diseases,5/18/2018,12/31/2019,8/10/2018,10-Aug-18,NCT03529903,Not Applicable,NA,Interventional,100,Recruiting,1,FALSE,Other,Other,Behavioral,Behavioral,Behavioral,FALSE,7,TRUE,Non-race specific,Non-race specific,2018,1,Non-Drug Intervention,Non-Industry Sponsor,Non-Race Specific
Dietary Approaches for Improving Cardiometabolic Health,5/17/2018,10/31/2018,1/15/2018,15-Jan-18,NCT03527290,Not Applicable,NA,Interventional,30,Completed,1,FALSE,Other,Other,"Behavioral, Behavioral",Behavioral,Behavioral,FALSE,NA,FALSE,Non-race specific,Non-race specific,2018,2,Non-Drug Intervention,Non-Industry Sponsor,Non-Race Specific
Safety and Tolerability of Escalating Doses of Subcutaneous Elafin (Tiprelestat) Injection in Healthy Normal Subjects,5/14/2018,4/30/2019,3/18/2019,18-Mar-19,NCT03522935,Phase 1,NA,Interventional,30,Recruiting,1,FALSE,Industry,Industry,"Drug, Drug",Drug,Pharmaceutical,FALSE,NA,FALSE,Non-race specific,Non-race specific,2018,2,Drug Intervention,Industry Sponsor,Non-Race Specific
Feasibility of Home Telehealth Monitoring for Improvement in Management of Hypertension for Secondary Stroke Prevention,5/7/2018,5/31/2019,12/20/2016,20-Dec-16,NCT03517709,Not Applicable,NA,Interventional,0,Withdrawn,1,FALSE,Other,Other,"Other, Device",Device,Device,FALSE,NA,FALSE,Non-race specific,Non-race specific,2018,2,Non-Drug Intervention,Non-Industry Sponsor,Non-Race Specific
Retail Outlet Health Kiosk Hypertension Trial,5/3/2018,5/31/2019,3/6/2019,6-Mar-19,NCT03515681,Not Applicable,NA,Interventional,140,Recruiting,1,FALSE,Other,Other,Behavioral,Behavioral,Behavioral,FALSE,NA,FALSE,Non-race specific,Non-race specific,2018,2,Non-Drug Intervention,Non-Industry Sponsor,Non-Race Specific
Using Lay Health Advisors to Help African Americans Address the Social Context of Hypertension Management,5/3/2018,2/28/2019,12/3/2018,3-Dec-18,NCT03515005,Not Applicable,NA,Interventional,312,Enrolling by invitation,1,FALSE,Other,Other,Behavioral,Behavioral,Behavioral,FALSE,18,TRUE,Non-race specific,Non-race specific,2018,1,Non-Drug Intervention,Non-Industry Sponsor,Non-Race Specific
Respiratory Muscle Contribution to Blood Pressure During Exercise in Healthy Humans,5/2/2018,11/30/2019,8/1/2018,1-Aug-18,NCT03514823,Not Applicable,NA,Interventional,80,Recruiting,1,FALSE,NIH,Public,"Other, Other",other,other,FALSE,NA,FALSE,Non-race specific,Non-race specific,2018,2,Non-Drug Intervention,Non-Industry Sponsor,Non-Race Specific
"An Integrated Assessment of the Safety and Effectiveness of Bexagliflozin Tablets, 20 mg, for the Management of Essential Hypertension",5/2/2018,9/30/2019,10/18/2017,18-Oct-17,NCT03514641,Phase 2/Phase 3,NA,Interventional,678,Completed,87,TRUE,Industry,Industry,"Drug, Drug",Drug,Pharmaceutical,FALSE,NA,FALSE,Non-race specific,Non-race specific,2018,2,Drug Intervention,Industry Sponsor,Non-Race Specific
Autonomic Control of the Circulation and the Venous Distension Reflex,5/2/2018,7/31/2019,7/12/2017,12-Jul-17,NCT03513770,Early Phase 1,NA,Interventional,18,Recruiting,1,FALSE,Other,Other,"Other, Drug, Drug",Drug,Pharmaceutical,FALSE,NA,FALSE,Non-race specific,Non-race specific,2018,2,Drug Intervention,Non-Industry Sponsor,Non-Race Specific
Glucagon-like Peptide-1 Metabolism in the Setting of Acute Neprilysin Inhibition,4/26/2018,7/31/2019,6/1/2018,1-Jun-18,NCT03508739,Phase 3,NA,Interventional,25,Suspended,1,FALSE,Other,Other,"Drug, Drug",Drug,Pharmaceutical,FALSE,NA,FALSE,Non-race specific,Non-race specific,2018,2,Drug Intervention,Non-Industry Sponsor,Non-Race Specific
Ethnic Differences in Anti-Hypertensive Medication Response Among Pregnant and Postpartum Patients,4/24/2018,6/30/2019,9/11/2017,11-Sep-17,NCT03506724,Phase 4,NA,Interventional,109,Completed,2,TRUE,Other,Other,"Drug, Drug",Drug,Pharmaceutical,FALSE,NA,FALSE,Non-race specific,Non-race specific,2018,2,Drug Intervention,Non-Industry Sponsor,Non-Race Specific
The Venous Distension Reflex and Orthostatic Hypertension,4/12/2018,4/30/2019,12/11/2017,11-Dec-17,NCT03496792,Not Applicable,NA,Interventional,30,Recruiting,1,FALSE,Other,Other,"Other, Other, Other, Other",other,other,FALSE,6,TRUE,Non-race specific,Non-race specific,2018,1,Non-Drug Intervention,Non-Industry Sponsor,Non-Race Specific
"A Prospective, Double-blind, Randomized, Placebo-controlled Trial of Acetazolamide on Subclinical High-Altitude Pulmonary Edema Detected by Lung Ultrasonography",4/6/2018,4/30/2019,3/23/2018,23-Mar-18,NCT03490916,Phase 4,NA,Interventional,18,Terminated,1,FALSE,Other,Other,"Drug, Drug",Drug,Pharmaceutical,TRUE,NA,FALSE,Non-race specific,Non-race specific,2018,2,Drug Intervention,Non-Industry Sponsor,Non-Race Specific
A Randomized Trial of Continuous Positive Airway Pressure (CPAP) for Sleep Apnea in Pregnancy,4/3/2018,1/31/2020,7/20/2018,20-Jul-18,NCT03487185,Not Applicable,NA,Interventional,2700,Recruiting,12,TRUE,NIH,Public,"Device, Other",Device,Device,FALSE,NA,FALSE,Non-race specific,Non-race specific,2018,2,Non-Drug Intervention,Non-Industry Sponsor,Non-Race Specific
"Nitrate-rich Fruit and Vegetable Supplement and Blood Pressure in Normotensive Healthy Young Males: a Randomized, Double-blinded, Placebo-controlled Trial",4/3/2018,3/31/2018,11/16/2015,16-Nov-15,NCT03486145,Not Applicable,NA,Interventional,57,Completed,1,FALSE,Other,Other,"Dietary Supplement, Dietary Supplement",other,other,FALSE,NA,FALSE,Non-race specific,Non-race specific,2018,2,Non-Drug Intervention,Non-Industry Sponsor,Non-Race Specific
Role of Angiotensin II and Chronic Inflammation in Persistent Microvascular Dysfunction Following Preeclamptic Pregnancy,3/29/2018,9/30/2019,8/26/2018,26-Aug-18,NCT03482440,Early Phase 1,NA,Interventional,32,Recruiting,2,TRUE,Other,Other,"Drug, Drug",Drug,Pharmaceutical,FALSE,NA,FALSE,Non-race specific,Non-race specific,2018,2,Drug Intervention,Non-Industry Sponsor,Non-Race Specific
NAD Therapy for Improving Memory and Brain Blood Flow in Older Adults With Mild Cognitive Impairment,3/29/2018,2/28/2019,12/1/2018,1-Dec-18,NCT03482167,Phase 1/Phase 2,NA,Interventional,58,Recruiting,1,FALSE,NIH,Public,"Drug, Other",Drug,Pharmaceutical,FALSE,NA,FALSE,Non-race specific,Non-race specific,2018,2,Drug Intervention,Non-Industry Sponsor,Non-Race Specific
Assessing the Effectiveness of a Multifaceted Implementation Strategy to Increase the Uptake of the USPSTF Hypertension Screening Recommendations in an Ambulatory Care Network: a Cluster Randomized Trial,3/29/2018,6/30/2019,4/2/2018,2-Apr-18,NCT03480217,Not Applicable,NA,Interventional,2000,Recruiting,1,FALSE,U.S. Fed,Public,Behavioral,Behavioral,Behavioral,FALSE,3,TRUE,Non-race specific,Non-race specific,2018,1,Non-Drug Intervention,Non-Industry Sponsor,Non-Race Specific
"High-Resolution, Relational, Resonance-Based, Electroencephalic Mirroring (HIRREM) for Stage 1 Primary Hypertension",3/27/2018,8/31/2019,8/8/2018,8-Aug-18,NCT03479697,Not Applicable,NA,Interventional,24,Recruiting,1,FALSE,Other,Other,"Device, Other",Device,Device,FALSE,NA,FALSE,Non-race specific,Non-race specific,2018,2,Non-Drug Intervention,Non-Industry Sponsor,Non-Race Specific
Targeting ADMA With Pioglitazone to Reduce Sympathetic Overactivity in CKD Patients,3/20/2018,4/30/2018,4/1/2018,1-Apr-18,NCT03471117,Phase 4,NA,Interventional,28,Recruiting,2,TRUE,Other,Other,"Drug, Other",Drug,Pharmaceutical,FALSE,NA,FALSE,Non-race specific,Non-race specific,2018,2,Drug Intervention,Non-Industry Sponsor,Non-Race Specific
Improving Albuminuria Screening Compliance Using a Smartphone Urinalysis Kit in the Hypertensive Non-Diabetic Population,3/20/2018,7/31/2018,3/19/2018,19-Mar-18,NCT03470701,Not Applicable,NA,Interventional,999,Completed,1,FALSE,Industry,Industry,Other,other,other,FALSE,NA,FALSE,Non-race specific,Non-race specific,2018,2,Non-Drug Intervention,Industry Sponsor,Non-Race Specific
